{
  "schemaVersion": 1,
  "product": "BAM.dev",
  "categories": [
    {
      "id": "language",
      "name": "언어",
      "status": "available",
      "description": "프로그래밍 언어와 웹 기술의 문법과 실행 원리를 학습합니다."
    },
    {
      "id": "algorithm",
      "name": "알고리즘",
      "status": "available",
      "description": "자료구조와 문제 해결 방법의 원리와 선택 기준을 학습합니다."
    },
    {
      "id": "cs",
      "name": "CS",
      "status": "planned",
      "description": "컴퓨터 과학의 기초 개념을 다루는 과정입니다."
    },
    {
      "id": "spring",
      "name": "Spring",
      "status": "available",
      "description": "Spring 핵심부터 Spring Boot 설정과 웹 요청·응답까지 작은 개념 문서로 학습합니다."
    }
  ],
  "courses": [
    {
      "id": "javascript-notes",
      "categoryId": "language",
      "languageId": "javascript",
      "name": "JavaScript 학습문서",
      "shortName": "JS 문서",
      "status": "available",
      "accent": "javascript",
      "description": "미리 작성한 학습 문서를 읽고 짧은 객관식으로 복습합니다."
    },
    {
      "id": "java",
      "categoryId": "language",
      "languageId": "java",
      "name": "Java",
      "shortName": "Java",
      "status": "available",
      "accent": "java",
      "description": "타입과 객체 중심으로 프로그램을 설계합니다."
    },
    {
      "id": "javascript",
      "categoryId": "language",
      "languageId": "javascript",
      "name": "JavaScript",
      "shortName": "JS",
      "status": "available",
      "accent": "javascript",
      "description": "값의 흐름부터 DOM과 비동기 처리까지 익힙니다."
    },
    {
      "id": "css",
      "categoryId": "language",
      "languageId": "css",
      "name": "CSS",
      "shortName": "CSS",
      "status": "available",
      "accent": "css",
      "description": "선택자와 박스 모델부터 레이아웃·반응형 표현까지 익힙니다."
    },
    {
      "id": "html",
      "categoryId": "language",
      "languageId": "html",
      "name": "HTML",
      "shortName": "HTML",
      "status": "available",
      "accent": "html",
      "description": "문서 구조부터 링크·콘텐츠·접근 가능한 폼까지 설계합니다."
    },
    {
      "id": "algorithm",
      "categoryId": "algorithm",
      "languageId": "java",
      "name": "알고리즘",
      "shortName": "ALGO",
      "status": "available",
      "accent": "java",
      "description": "Java 25를 기준으로 기본 자료구조부터 그래프와 동적 계획법까지 문제 해결 원리를 익힙니다.",
      "unitNumberStart": 0
    },
    {
      "id": "spring",
      "categoryId": "spring",
      "languageId": "java",
      "name": "Spring · Spring Boot",
      "shortName": "Spring",
      "status": "available",
      "accent": "java",
      "description": "Java 객체 연결과 Boot 설정에서 시작해 MVC 요청 처리, Security 접근 제어, JPA 데이터 저장·조회와 테스트 경계를 익힙니다."
    }
  ],
  "languages": [
    {
      "id": "javascript",
      "name": "JavaScript",
      "shortName": "JS",
      "status": "available",
      "accent": "javascript",
      "description": "값의 흐름부터 DOM과 비동기 처리까지 연결합니다."
    },
    {
      "id": "html",
      "name": "HTML",
      "shortName": "HTML",
      "status": "available",
      "accent": "html",
      "description": "문서 구조부터 링크·콘텐츠·접근 가능한 폼까지 설계합니다."
    },
    {
      "id": "css",
      "name": "CSS",
      "shortName": "CSS",
      "status": "available",
      "accent": "css",
      "description": "선택자와 박스 모델부터 레이아웃·반응형 표현까지 익힙니다."
    },
    {
      "id": "java",
      "name": "Java",
      "shortName": "Java",
      "status": "available",
      "accent": "java",
      "description": "타입과 객체 중심으로 프로그램을 설계합니다."
    }
  ],
  "lessons": [
    {
      "id": "js-notes-values",
      "languageId": "javascript",
      "courseId": "javascript-notes",
      "order": 1,
      "slug": "values",
      "title": "값과 실행 흐름",
      "summary": "값의 타입, 변수, 조건과 반복을 입력·상태·판단·결과로 나누어 복습합니다.",
      "essentialQuestion": "말로 적은 요구사항을 JavaScript가 처리할 값과 실행 순서로 어떻게 바꿀까요?",
      "objectives": [
        "요구사항을 JavaScript가 처리할 수 있는 값과 실행 순서로 나누어 설명합니다.",
        "const와 let, 숫자 덧셈과 문자열 연결을 구분하고 조건·반복의 실행 결과를 예측합니다."
      ],
      "estimatedMinutes": 15,
      "conceptIds": [
        "js.values-types",
        "js.variables",
        "js.operators",
        "js.control-flow"
      ],
      "contentFile": "content/lessons/javascript-notes/values.md",
      "source": {
        "kind": "user-authored",
        "verifiedAt": "2026-09-09",
        "originalPath": "profile/경험/학습/밤데브 학습문서/03 JavaScript/01 값과 실행 흐름.md",
        "sha256": "f8e8830657878543ffae84334a3c33d270ec2453f486e6a77d2fafafabf4cdc5",
        "importedAt": "2026-09-09",
        "importMode": "copy"
      },
      "archivedFromCatalog": true
    },
    {
      "id": "js-notes-functions",
      "languageId": "javascript",
      "courseId": "javascript-notes",
      "order": 2,
      "slug": "functions",
      "title": "함수",
      "summary": "입력·반환값·바꾸는 상태를 구분하고 함수 호출의 흐름을 복습합니다.",
      "essentialQuestion": "여러 번 필요한 계산과 판단을 입력과 결과를 가진 작은 동작으로 어떻게 나눌까요?",
      "objectives": [
        "여러 번 필요한 계산과 판단을 입력과 결과를 가진 작은 동작으로 나누는 방법을 설명합니다.",
        "반환값·조기 반환·동기 콜백의 실행 순서를 예측하고 함수 밖에서 바뀌는 상태를 구분합니다."
      ],
      "estimatedMinutes": 15,
      "conceptIds": [
        "js.functions",
        "js.function-return",
        "js.callbacks",
        "js.function-side-effects"
      ],
      "contentFile": "content/lessons/javascript-notes/functions.md",
      "source": {
        "kind": "user-authored",
        "verifiedAt": "2026-09-09",
        "originalPath": "profile/경험/학습/밤데브 학습문서/03 JavaScript/02 함수.md",
        "sha256": "c9fa256cdd5b7e364477f0bae0ae9d0a3a750a37dc59f7f511b0c822219683f0",
        "importedAt": "2026-09-09",
        "importMode": "copy"
      },
      "archivedFromCatalog": true
    },
    {
      "id": "js-notes-collections",
      "languageId": "javascript",
      "courseId": "javascript-notes",
      "order": 3,
      "slug": "collections",
      "title": "배열과 객체",
      "summary": "배열과 객체의 선택 목적, 필요한 결과 모양과 원본 변경 여부를 복습합니다.",
      "essentialQuestion": "여러 값의 순서와 한 대상의 이름 있는 정보를 어떻게 나누어 담을까요?",
      "objectives": [
        "여러 값의 순서와 한 대상의 이름 있는 정보를 배열과 객체로 나누는 방법을 설명합니다.",
        "배열 처리의 결과 모양·검색 실패·순회 값과 객체 공유를 구분하고 결과를 예측합니다."
      ],
      "estimatedMinutes": 15,
      "conceptIds": [
        "js.arrays",
        "js.objects",
        "js.array-methods",
        "js.object-sharing",
        "js.iteration"
      ],
      "contentFile": "content/lessons/javascript-notes/collections.md",
      "source": {
        "kind": "user-authored",
        "verifiedAt": "2026-09-09",
        "originalPath": "profile/경험/학습/밤데브 학습문서/03 JavaScript/03 배열과 객체.md",
        "sha256": "9186ad12699f3ac69f0231b18ab08627513f2cabe435d8a13757825bea8dd082",
        "importedAt": "2026-09-09",
        "importMode": "copy"
      },
      "archivedFromCatalog": true
    },
    {
      "id": "js-01-runtime",
      "languageId": "javascript",
      "courseId": "javascript",
      "order": 1,
      "slug": "javascript-and-runtime",
      "title": "JavaScript와 실행",
      "summary": "JavaScript가 하는 일과 파일을 불러와 실행하는 순서를 배웁니다.",
      "essentialQuestion": "JavaScript 파일은 언제 불러오고, 어느 줄부터 실행할까요?",
      "objectives": [
        "HTML은 내용, CSS는 모양, JavaScript는 동작을 맡는다는 것을 이해합니다.",
        "JavaScript의 공통 규칙과 브라우저가 준비한 도구를 구분합니다.",
        "HTML과 JavaScript 파일을 연결하고, HTML이 준비된 뒤 코드를 실행할 수 있습니다.",
        "간단한 코드는 첫 줄부터 아래로 차례대로 실행된다는 것을 이해합니다."
      ],
      "estimatedMinutes": 25,
      "conceptIds": [
        "js.ecmascript",
        "js.runtime",
        "js.script-loading",
        "js.execution-order"
      ],
      "contentFile": "content/lessons/javascript/javascript-and-runtime.md",
      "source": {
        "kind": "user-authored",
        "verifiedAt": "2026-08-18"
      }
    },
    {
      "id": "js-02-values-control-flow",
      "languageId": "javascript",
      "courseId": "javascript",
      "order": 2,
      "slug": "values-variables-control-flow",
      "title": "값·변수·연산자·제어문",
      "summary": "값에 이름을 붙여 기억하고, 조건과 반복으로 필요한 코드를 실행하는 방법을 배웁니다.",
      "essentialQuestion": "값을 기억하고, 상황에 따라 다른 일을 시키려면 어떻게 할까요?",
      "objectives": [
        "글자, 숫자, 참·거짓이 서로 다른 종류의 값임을 이해합니다.",
        "const와 let 중 알맞은 선언을 선택할 수 있습니다.",
        "=, +=, ===처럼 값을 바꾸거나 확인하는 기본 연산자를 읽을 수 있습니다.",
        "if와 for...of로 실행할 코드와 반복할 코드를 정할 수 있습니다."
      ],
      "estimatedMinutes": 45,
      "conceptIds": [
        "js.values-types",
        "js.variables",
        "js.operators",
        "js.control-flow"
      ],
      "contentFile": "content/lessons/javascript/values-variables-control-flow.md",
      "source": {
        "kind": "user-authored",
        "verifiedAt": "2026-08-24"
      },
      "archivedFromCatalog": true
    },
    {
      "id": "js-03-functions-scope-closure",
      "languageId": "javascript",
      "courseId": "javascript",
      "order": 3,
      "slug": "functions-scope-closure",
      "title": "함수·스코프·클로저",
      "summary": "동작을 함수로 묶고 값이 보이는 범위와 유지되는 원리를 익힙니다.",
      "essentialQuestion": "반복되는 동작을 묶고 값의 사용 범위를 관리하려면 어떻게 할까요?",
      "objectives": [
        "함수의 매개변수, 인수, 반환값을 구분할 수 있습니다.",
        "함수 선언문, 함수 표현식, 화살표 함수의 기본 차이를 이해합니다.",
        "스코프가 변수의 사용 가능 범위를 정한다는 것을 설명할 수 있습니다.",
        "클로저가 함수와 선언 당시의 렉시컬 환경의 결합이라는 뜻을 이해합니다."
      ],
      "estimatedMinutes": 45,
      "conceptIds": [
        "js.functions",
        "js.scope",
        "js.closure"
      ],
      "contentFile": "content/lessons/javascript/functions-scope-closure.md",
      "source": {
        "kind": "user-authored",
        "verifiedAt": "2026-08-18"
      },
      "archivedFromCatalog": true
    },
    {
      "id": "js-04-collections",
      "languageId": "javascript",
      "courseId": "javascript",
      "order": 4,
      "slug": "arrays-objects-built-ins",
      "title": "배열·객체·표준 내장 객체",
      "summary": "여러 값과 관련된 데이터를 구조화하고 표준 도구로 가공합니다.",
      "essentialQuestion": "여러 데이터와 서로 관련된 데이터를 어떻게 다룰까요?",
      "objectives": [
        "배열과 객체를 언제 사용하는지 구분할 수 있습니다.",
        "배열 메서드의 입력, 반환값, 원본 변경 여부를 확인하며 사용할 수 있습니다.",
        "객체의 속성을 점 표기법과 대괄호 표기법으로 읽고 바꿀 수 있습니다.",
        "String, Number, Math, Date, JSON 같은 표준 내장 객체의 역할을 이해합니다."
      ],
      "estimatedMinutes": 55,
      "conceptIds": [